<?xml version="1.0" encoding="UTF-8" standalone="yes"?>
<!--
    Document   : save_example.xml.xml
    Created on : August 31, 2014, 3:31 PM
    Author     : Johan Sarrazin / Céline Fouard / Nicolas Glade
    Description:
        Purpose of the document follows.
-->
<profil xmlns="http://myGame/tux" xmlns:xsi="http://www.w3.org/2001/XMLSchema-instance" xsi:schemaLocation="http://myGame/tux ../xsd/profil.xsd">
    <nom>Alban</nom>
    <avatar>../images/bear.png</avatar>
    <anniversaire>2006-05-08</anniversaire>
    <parties>
        <partie id="1" date="2013-12-10">
            <temps>20.0</temps>
            <mot niveau="1">cle</mot>
        </partie>
        <partie id="2" date="2013-12-11" trouvé="75%">
            <temps>15.0</temps>
            <mot niveau="2">indice</mot>
        </partie>
        <partie id="3" date="2013-12-11">
            <temps>12.0</temps>
            <mot niveau="2">indice</mot>
        </partie>
    </parties>
</profil>


